{
  "id": "info:root/xyzzy.0256/pamphlet",
  "parent": "info:root/xyzzy.0256",
  "systemIdentifier": "b20b2aa0-cc96-52a0-b1ef-c0e6833c0cb7",
  "interactionModel": "urn:umich:lib:dor:model:2026:resource:glam",
  "contentSize": 2,
  "digests": [
    "urn:sha-512:27c74670adb75075fad058d5ceaf7b20c4e7786c83bae8a32f626f9782af34c9a33c2046ef60fd2a7878d378e29fec851806bbd9a67878f3a9f1cda4830763fd"
  ],
  "updatedAt": "2026-03-16T17:54:29Z",
  "updatedBy": "dlxsadm",
  "deleted": false,
  "visibility": "visible",
  "contentPath": "core.dor.json",
  "headersVersion": "1.0"
}