{
  "id": "info:root/xyzzy.0001",
  "parent": "info:root",
  "systemIdentifier": "a2745177-391a-5754-90b7-0c71abfa2766",
  "interactionModel": "urn:umich:lib:dor:model:2026:resource:glam",
  "contentSize": 137,
  "digests": [
    "urn:sha-512:a9d0442486f73ced76c3044a502deefea4e0a9c420595a53247b2bb6cc8ee03de783ba932a27ad78d1096b9bdc7572041bfe9a7fee5dc1ba0ea5d044d8c3a614"
  ],
  "updatedAt": "2026-03-16T16:54:24Z",
  "updatedBy": "dlxsadm",
  "deleted": false,
  "visibility": "visible",
  "contentPath": "core.dor.json",
  "headersVersion": "1.0"
}